Name,Description,Citation,DOI URL,LOINC,Licencing/Royalty,Wikipedia,Wikidata,Link
DASS 21,,"Henry JD, Crawford JR. The short-form version of the Depression Anxiety Stress Scales (DASS-21): construct validity and normative data in a large non-clinical sample. Br J Clin Psychol. 2005 Jun;44(Pt 2):227-39. doi: 10.1348/014466505X29657. PMID: 16004657.",https://doi.org/10.1348/014466505x29657,,,https://en.wikipedia.org/wiki/DASS_(psychology),
PHQ-9,The PHQ-9: Validity of a Brief Depression Severity Measure - PMC,"Kroenke K, Spitzer RL, Williams JB. The PHQ-9: validity of a brief depression severity measure. J Gen Intern Med. 2001 Sep;16(9):606-13. doi: 10.1046/j.1525-1497.2001.016009606.x. PMID: 11556941; PMCID: PMC1495268.",https://doi.org/10.1046/j.1525-1497.2001.016009606.x,,,https://en.wikipedia.org/wiki/PHQ-9,https://github.com/LHNCBC/lforms/blob/master/test/data/R4/phq9.json
K10,KESSLER PSYCHOLOGICAL DISTRESS SCALE,,,,,,
MADRS,MontgomeryЁsberg Depression Rating Scale,"Montgomery SA, Asberg M. A new depression scale designed to be sensitive to change. Br J Psychiatry. 1979 Apr;134:382-9. doi: 10.1192/bjp.134.4.382. PMID: 444788.",https://doi.org/10.1192/bjp.134.4.382,,,"https://en.wikipedia.org/wiki/Montgomery%E2%80%93%C3%85sberg_Depression_Rating_Scale#:~:text=The%20Montgomery%E2%80%93%C3%85sberg%20Depression%20Rating,in%20patients%20with%20mood%20disorders.",
AUDIT,Alcohol Use Disorders Identification Test,"Saunders JB, Aasland OG, Babor TF, de la Fuente JR, Grant M. Development of the Alcohol Use Disorders Identification Test (AUDIT): WHO Collaborative Project on Early Detection of Persons with Harmful Alcohol Consumption--II. Addiction. 1993 Jun;88(6):791-804. doi: 10.1111/j.1360-0443.1993.tb02093.x. PMID: 8329970.",https://doi.org/10.1111/j.1360-0443.1993.tb02093.x,,,,
AMTS,Abbreviated Mental Test Score,Hodkinson HM. Evaluation of a mental test score for assessment of mental impairment in the elderly. Age Ageing. 1972 Nov;1(4):233-8. doi: 10.1093/ageing/1.4.233. PMID: 4669880.,https://doi.org/10.1093/ageing/1.4.233,,,,
IQCODE,Informant questionnaire on cognitive decline in the elderly (IQCODE) form,Jorm AF. A short form of the Informant Questionnaire on Cognitive Decline in the Elderly (IQCODE): development and cross-validation. Psychological Medicine. 1994;24(1):145-153. doi:10.1017/S003329170002691X,,,,,
PSYCHOGERIATRIC ASSESSMENT SCALES (PAS) - INFORMANT INTERVIEW FORM,,"Jorm AF, Mackinnon AJ, Henderson AS, Scott R, Christensen H, Korten AE, Cullen JS, Mulligan R. The Psychogeriatric Assessment Scales: a multi-dimensional alternative to categorical diagnoses of dementia and depression in the elderly. Psychol Med. 1995 May;25(3):447-60. doi: 10.1017/s0033291700033377. PMID: 7480426.",https://doi.org/10.1017/s0033291700033377,,,,
